{
  "$schema": "https://darkroom-finish.local/schemas/adobe-operation-registry-v1.schema.json",
  "schema_version": "adobe-operation-registry/v1",
  "registry_id": "adobe.operations",
  "version": "0.1.0",
  "target_environment": {
    "photoshop": "25.2.0",
    "camera_raw": "16.5 (1954)",
    "process_version": "15.4"
  },
  "promotion_requirements": [
    "documented",
    "schema_representable",
    "executor_write",
    "executor_readback",
    "fixture_probe",
    "replay"
  ],
  "enum_domains": [
    {
      "schema_version": "adobe-operation-enum-domain/v1",
      "registry_id": "adobe.white_balance",
      "version": "1.0.0",
      "values": [
        "AS_SHOT",
        "AUTO",
        "CLOUDY",
        "CUSTOM",
        "DAYLIGHT",
        "FLASH",
        "FLUORESCENT",
        "SHADE",
        "TUNGSTEN"
      ],
      "native_values": {
        "AS_SHOT": "As Shot",
        "AUTO": "Auto",
        "CLOUDY": "Cloudy",
        "CUSTOM": "Custom",
        "DAYLIGHT": "Daylight",
        "FLASH": "Flash",
        "FLUORESCENT": "Fluorescent",
        "SHADE": "Shade",
        "TUNGSTEN": "Tungsten"
      },
      "registry_sha256": "9237e5b15500e567aa92a0e93d87860d2343841c5c72837336f555ff08798d40"
    },
    {
      "schema_version": "adobe-operation-enum-domain/v1",
      "registry_id": "adobe.crop_enabled",
      "version": "1.0.0",
      "values": [
        "FALSE",
        "TRUE"
      ],
      "native_values": {
        "FALSE": "False",
        "TRUE": "True"
      },
      "registry_sha256": "df19a9680361082e15ca4f5665d0b1ac098bb766ea2ecb14f083715d35c236e7"
    }
  ],
  "operations": [
    {
      "operation_id": "acr.blacks2012",
      "field": "blacks2012",
      "product": "camera_raw",
      "family": "basic_tone",
      "value_type": "scalar",
      "native_unit": "adobe:percent",
      "native_range": {
        "lower": "-100",
        "upper": "100",
        "inclusivity": "closed"
      },
      "scope": "global",
      "charter_class": "allowed",
      "transport": {
        "kind": "xmp_attribute",
        "key": "Blacks2012"
      },
      "evidence": {
        "documented": {
          "status": "supported",
          "evidence_ref": "references/operations.md#implementation"
        },
        "schema_representable": {
          "status": "supported",
          "evidence_ref": "references/operations.md#implementation"
        },
        "executor_write": {
          "status": "supported",
          "evidence_ref": "references/operations.md#implementation"
        },
        "executor_readback": {
          "status": "unverified",
          "evidence_ref": null
        },
        "fixture_probe": {
          "status": "unverified",
          "evidence_ref": null
        },
        "replay": {
          "status": "unverified",
          "evidence_ref": null
        }
      },
      "enum_domain_ref": null
    },
    {
      "operation_id": "acr.brush_mask",
      "field": null,
      "product": "camera_raw",
      "family": "local_masks",
      "value_type": "mask_graph",
      "native_unit": null,
      "native_range": null,
      "scope": "local",
      "charter_class": "conditional",
      "transport": {
        "kind": "xmp_mask_graph",
        "key": "MaskGroupBasedCorrections"
      },
      "evidence": {
        "documented": {
          "status": "supported",
          "evidence_ref": "references/operations.md#implementation"
        },
        "schema_representable": {
          "status": "supported",
          "evidence_ref": "references/operations.md#implementation"
        },
        "executor_write": {
          "status": "supported",
          "evidence_ref": "references/operations.md#implementation"
        },
        "executor_readback": {
          "status": "unverified",
          "evidence_ref": null
        },
        "fixture_probe": {
          "status": "unverified",
          "evidence_ref": null
        },
        "replay": {
          "status": "unverified",
          "evidence_ref": null
        }
      },
      "enum_domain_ref": null
    },
    {
      "operation_id": "acr.calibration_blue_primary_hue",
      "field": "calibration_blue_primary_hue",
      "product": "camera_raw",
      "family": "calibration",
      "value_type": "scalar",
      "native_unit": "adobe:percent",
      "native_range": {
        "lower": "-100",
        "upper": "100",
        "inclusivity": "closed"
      },
      "scope": "global",
      "charter_class": "allowed",
      "transport": {
        "kind": "xmp_attribute",
        "key": "BlueHue"
      },
      "evidence": {
        "documented": {
          "status": "supported",
          "evidence_ref": "references/operations.md#implementation"
        },
        "schema_representable": {
          "status": "supported",
          "evidence_ref": "references/operations.md#implementation"
        },
        "executor_write": {
          "status": "supported",
          "evidence_ref": "references/operations.md#implementation"
        },
        "executor_readback": {
          "status": "unverified",
          "evidence_ref": null
        },
        "fixture_probe": {
          "status": "unverified",
          "evidence_ref": null
        },
        "replay": {
          "status": "unverified",
          "evidence_ref": null
        }
      },
      "enum_domain_ref": null
    },
    {
      "operation_id": "acr.calibration_blue_primary_saturation",
      "field": "calibration_blue_primary_saturation",
      "product": "camera_raw",
      "family": "calibration",
      "value_type": "scalar",
      "native_unit": "adobe:percent",
      "native_range": {
        "lower": "-100",
        "upper": "100",
        "inclusivity": "closed"
      },
      "scope": "global",
      "charter_class": "allowed",
      "transport": {
        "kind": "xmp_attribute",
        "key": "BlueSaturation"
      },
      "evidence": {
        "documented": {
          "status": "supported",
          "evidence_ref": "references/operations.md#implementation"
        },
        "schema_representable": {
          "status": "supported",
          "evidence_ref": "references/operations.md#implementation"
        },
        "executor_write": {
          "status": "supported",
          "evidence_ref": "references/operations.md#implementation"
        },
        "executor_readback": {
          "status": "unverified",
          "evidence_ref": null
        },
        "fixture_probe": {
          "status": "unverified",
          "evidence_ref": null
        },
        "replay": {
          "status": "unverified",
          "evidence_ref": null
        }
      },
      "enum_domain_ref": null
    },
    {
      "operation_id": "acr.calibration_green_primary_hue",
      "field": "calibration_green_primary_hue",
      "product": "camera_raw",
      "family": "calibration",
      "value_type": "scalar",
      "native_unit": "adobe:percent",
      "native_range": {
        "lower": "-100",
        "upper": "100",
        "inclusivity": "closed"
      },
      "scope": "global",
      "charter_class": "allowed",
      "transport": {
        "kind": "xmp_attribute",
        "key": "GreenHue"
      },
      "evidence": {
        "documented": {
          "status": "supported",
          "evidence_ref": "references/operations.md#implementation"
        },
        "schema_representable": {
          "status": "supported",
          "evidence_ref": "references/operations.md#implementation"
        },
        "executor_write": {
          "status": "supported",
          "evidence_ref": "references/operations.md#implementation"
        },
        "executor_readback": {
          "status": "unverified",
          "evidence_ref": null
        },
        "fixture_probe": {
          "status": "unverified",
          "evidence_ref": null
        },
        "replay": {
          "status": "unverified",
          "evidence_ref": null
        }
      },
      "enum_domain_ref": null
    },
    {
      "operation_id": "acr.calibration_green_primary_saturation",
      "field": "calibration_green_primary_saturation",
      "product": "camera_raw",
      "family": "calibration",
      "value_type": "scalar",
      "native_unit": "adobe:percent",
      "native_range": {
        "lower": "-100",
        "upper": "100",
        "inclusivity": "closed"
      },
      "scope": "global",
      "charter_class": "allowed",
      "transport": {
        "kind": "xmp_attribute",
        "key": "GreenSaturation"
      },
      "evidence": {
        "documented": {
          "status": "supported",
          "evidence_ref": "references/operations.md#implementation"
        },
        "schema_representable": {
          "status": "supported",
          "evidence_ref": "references/operations.md#implementation"
        },
        "executor_write": {
          "status": "supported",
          "evidence_ref": "references/operations.md#implementation"
        },
        "executor_readback": {
          "status": "unverified",
          "evidence_ref": null
        },
        "fixture_probe": {
          "status": "unverified",
          "evidence_ref": null
        },
        "replay": {
          "status": "unverified",
          "evidence_ref": null
        }
      },
      "enum_domain_ref": null
    },
    {
      "operation_id": "acr.calibration_red_primary_hue",
      "field": "calibration_red_primary_hue",
      "product": "camera_raw",
      "family": "calibration",
      "value_type": "scalar",
      "native_unit": "adobe:percent",
      "native_range": {
        "lower": "-100",
        "upper": "100",
        "inclusivity": "closed"
      },
      "scope": "global",
      "charter_class": "allowed",
      "transport": {
        "kind": "xmp_attribute",
        "key": "RedHue"
      },
      "evidence": {
        "documented": {
          "status": "supported",
          "evidence_ref": "references/operations.md#implementation"
        },
        "schema_representable": {